5062242853,Beijing Aihua Women & Children Sanitary Products Co Ltd,CN,Act
5062242856,"JINING NAIVE FOODSTUFF CO.,LTD.",CN,Act
5062242857,Jining Brother International Trading Co Ltd,CN,Act
5062242858,Jining Fenduni Foodstuff CoLTD,CN,Act
5062242863,Jiangsu Gaokang Freeze-Dried Foods Co Ltd,CN,Act
5062242870,Heze Juancheng Jinlu Livestock Products Co Ltd,CN,Act
5062242879,Laiwu Evergreen Food Co Ltd,CN,Act
5062242893,NingAn Taiji Biochemical Co Ltd,CN,Act
5062242913,Qingdao Sanfod Jinhao Trading Co Ltd,CN,Act
5062242915,Shandong Seawind Regal Foods CoLTD,CN,Act
5062242916,Shandong Gaomi Pengyuan Foodstuff Co Ltd,CN,Act
5062242962,Dalian Hojo Food Co Ltd,CN,Act
5062242993,Shanghai Yilin Foodstuff Co Ltd,CN,Act
5062243001,Puning Haichang Foodstuff Co Ltd,CN,Act
5062243019,Fujian Taifeng Refrigeration Food CoLTD,CN,Act
5062243042,Changzhou Tianda Decorative Material Co Ltd,CN,Act
5062243078,Shanghai Rili Fine Chemical Factory,CN,Act
5062243083,Qingdao HuaOu Group Xiangmingyuan Co Ltd,CN,Act
5062243111,Longhai Senmao Plastic Co Ltd,CN,Act
5062243114,Guangzhou Haizhu District Xinzhujiang Distilled Water Co Ltd,CN,Act
5062243128,Gardens Virescence Management Division of Mawei District Fuzhou Municipality,CN,Act
5062243129,Shanghai Tobacco Materials Factory Pudong Jointly-Owned Co Ltd,CN,Act
5062243135,"QIXIA SITONG FRUIT & VEGETABLE PRODUCTS CO.,LTD.",CN,Act
5062243136,Linyi Shanhe Rices CoLTD,CN,Act
5062243137,Linyi Yuhua Food CoLTD,CN,Act
5062243160,Rizhao Lanshan Libo Refrigeration Factory,CN,Act
5062243173,Tianye Fujian Modern Agriculture Development Co Ltd,CN,Act
5062243191,Dalian Shengjie Aquatic Food Co Ltd,CN,Act
5062243194,Yantai Guolian Foodstuff Processing CoLTD,CN,Act
5062243198,Leshan Wutongqiao Shuixiang Foodstuff Co Ltd,CN,Act
5062243203,Shandong Jinbaoluo Foodstuff & Beverage Co Ltd,CN,Act
5062243222,Liaoning Pharmaceutical Development Co Ltd,CN,Act
5062243225,Jiaxiang County Xincang Flour Co Ltd,CN,Act
5062243239,Shandong Lisheng Group Wenshang Noodles Co Ltd,CN,Act
5062243252,Beijing Zhuochen Animal Husbandry Co Ltd,CN,Act
5062243260,Ling County Xuri Daily Chemical CoLTD,CN,Act
5062243261,Gaotang County Shuanglong Flour Manufacturing CoLTD,CN,Act
5062243267,Anqiu Jinfeng Food Co Ltd,CN,Act
5062243272,Shandong Yujie Flour Co Ltd,CN,Act
5062243274,Rongcheng Huangshan Datian Frozen Foodstuffs Factory,CN,Act
5062243276,Shandong Huatai Intelligent Technology Co Ltd,CN,Act
5062243286,Anqiu Jintian Foodstuff Co Ltd,CN,Act
5062243293,Shandong Limin Pharmacy Franchises CoLTD,CN,Act
5062243294,Sichuan Xinglin Chain Pharmacy Co Ltd,CN,Act
5062243302,Laiyang Yuantai Food Co Ltd,CN,Act
5062243307,"NANTONG NEW WORLD GLORY CASING CO., LTD",CN,Act
5062243326,Qingdao Hantone International Trading Corp,CN,Act
5062243327,Yantai Yitian Food CoLTD,CN,Act
5062243348,Xiamen Nature Caring Products CoLTD,CN,Act
5062243351,High Fortune Fuzhou Imp & Exp Co Ltd,CN,Act
5062243356,Qingdao Deyun Foodstuff Co Ltd,CN,Act
5062243359,Jinxiang County Sanlong Vegetable and Fruit Products Co Ltd,CN,Act
5062243362,Wenzhou Safran Trade Co Ltd,CN,Act
5062243364,Jinxiang County Tailong Commerce and Trade Co Ltd,CN,Act
5062243366,"Dalian Happy Fortunes Trading Co., Ltd",CN,Act
5062243368,Guangzhou Shunmin Fenglong Agricultural Products Co Ltd,CN,Act
5062243372,Aosi Cosmetic Shanghai Co Ltd,CN,Act
5062243390,Shandong Saikang Lanshan Soybean Biological Products Co Ltd,CN,Act
5062243393,Shine & Shine Food Anhui Co Ltd,CN,Act
5062243400,Suifenhe Baofu Economy & Trade Co Ltd,CN,Act
5062243405,Qingdao Jinguo Shunde Foodstuff Co Ltd,CN,Act
5062243416,Shandong Tianfang Pharmaceutical CoLTD,CN,Act
5062243426,Shenzhen Beidachang Economic and Trade CoLTD,CN,Act
5062243428,Guangdong Yuexing Industrial Development Co Ltd,CN,Act
5062243429,Weifang Jiahe Foodstuff Co Ltd,CN,Act
5062243436,Xiaoyangren Biological Dairy Industry Co Ltd,CN,Act
5062243440,Shandong Retouch Wash and Sterilize Technology CoLTD,CN,Act
5062243441,Binzhou Zhongda Livestock Industry CoLTD,CN,Act
5062243449,"LUOHE ZHONGRUN FOOD CO., LTD.",CN,Act
5062243450,Henan Tianxiang Flour Industry Co Ltd,CN,Act
5062243455,Bestmaker Food Suqian Co Ltd,CN,Act
5062243460,Guangdong Zhaolong Biological Technology Co Ltd,CN,Act
5062243470,Suzhou Meijia Beatrice Chain Store Co Ltd,CN,Act
5062243472,"YANTAI SHINHO WEIDAMEI FOOD CO., LTD.",CN,Act
5062243473,Zhangzhou Hengfeng Foodstuff Factory,CN,Act
5062243482,TaiAn Zhongcheng Feedstuff Technology Co Ltd,CN,Act
5062243490,Shenzhen Shengzhongda Industry Co Ltd,CN,Act
5062243494,Shenzhen Tiancheng Foodstuff Co Ltd,CN,Act
5062243502,Zhongshan Dai Sing Frozen Food Co Ltd,CN,Act
5062243522,Guangxi Juyuan Sugar Industry Co Ltd,CN,Act
5062243533,Nanning Shanlian Commerce & Trade Co Ltd,CN,Act
5062243543,Rizhao Yikang Foodstuff Co Ltd,CN,Act
5062243572,Xiamen Senjia Foodstuff Co Ltd,CN,Act
5062243573,Sinkiang Lvhua Sugar Industry Co Ltd,CN,Act
5062243586,Jinan Tianfu Ming Tea Co Ltd,CN,Act
5062243592,Luohe Fumeiyuan Foodstuff Industry Co Ltd,CN,Act
5062243595,Leping Hengli Chemical Co Ltd,CN,Act
5062243596,Chengwu County Zhengye Paper Products Commerce Development Co Ltd,CN,Act
5062243604,"HUANGSHAN TRAVEL GROUP JIALONG GREEN FOOD CO., LTD.",CN,Act
5062243609,Yantai Yuanyuan Foodstuff Co Ltd,CN,Act
5062243616,"ZHONGSHAN FULIN COSMETICS CO., LTD.",CN,Act
5062243630,Hangzhou LinAn Tianmu Meat Processing Co Ltd,CN,Act
5062243631,Shanghai Great Champion Feed Tech CoLTD,CN,Act
5062243641,Yongchun County Kuidou Lifang Tea Factory,CN,Act
5062243659,Yunnan Sairui Foodstuff Co Ltd,CN,Act
5062243665,Xiamen Sharing Menicines & Health Products Imp/Exp CoLTD,CN,Act
5062243668,Hebei Yihoucheng Commodity CoLTD,CN,Act
5062243681,Hubei Taigeli Arts & Crafts Products Co Ltd,CN,Act
5062243690,Liaoning Qiyunsheng Pharmacy Chain Co Ltd,CN,Act
5062243692,Fujian Tangchun Pharmaceutical Co Ltd,CN,Act
5062243698,Fuzhou Shanhui Foodstuff Co Ltd,CN,Act
