Instrument,Company Common Name,Country ISO Code of Headquarters,Organization Status Code
5062225124,Sichuan Yuanhongxiao Jiaolou Winery CoLTD,CN,Act
5062225127,Qu County Hongfa Meat United Factory,CN,Act
5062225128,Guiyang Weichunyuan Food Co Ltd,CN,Act
5062225134,Simao Jiangcheng Liliang Biology Products Co Ltd,CN,Act
5062225140,Cofco Tunhe Ili Xinning Sugar Industry Co Ltd,CN,Act
5062225146,Changling County Slaughter Factory,CN,Act
5062225151,Jiangsu Shudong Oil and Foodstuffs CoLTD,CN,Act
5062225152,HuaiAn Xingda Bristle Brush Co Ltd,CN,Act
5062225157,Zhejiang Yaolian Capsule Co Ltd,CN,Act
5062225162,Guangzhou Li Feng Hang Foods CoLTD,CN,Act
5062225175,Rushan Xuelianshan Brewery Co Ltd,CN,Act
5062225177,Weifang Zhenxiang Food Co Ltd,CN,Act
5062225179,Yanling County Malan Zhenya Cotton Industry Co Ltd,CN,Act
5062225193,Yueyang County Xichong Livestocks Birds & Aquatic Products Co Ltd,CN,Act
5062225194,Huarong County Zhuangyuan Foodstuff Factory,CN,Act
5062225206,GuangAn JinguangAn Wine Industry Co Ltd,CN,Act
5062225209,Chongqing Feng Du San He CoLTD,CN,Act
5062225214,Huan County Jinpeng Meat Foodstuff Co Ltd,CN,Act
5062225215,Lanzhou Jindou Commerce & Trade Co Ltd,CN,Act
5062225221,Nanning Shili Feedstuff Factory,CN,Act
5062225251,Zitong County Tiancheng Meat Products Co,CN,Act
5062225255,Sichuan Neijiang Yangsheng Food CoLTD,CN,Act
5062225258,Leshan Wanshan Livestock Products Co Ltd,CN,Act
5062225261,Sichuan Hongteng Jiawei Food CoLTD,CN,Act
5062225264,Sichuan Nanchong Huaxin Industry CoLTD,CN,Act
5062225269,Xuanhan County Jinxiang Foodstuff Co Ltd,CN,Act
5062225273,Guizhou Jiusheng Wine Industry Co Ltd,CN,Act
5062225301,Lvshun Xinshun Aquatic Products Foodstuff Co Ltd,CN,Act
5062225306,DaAn BaiE Production Co Ltd,CN,Act
5062225328,Laizhou Jincheng Town Jinhai Fruits & Vegetables Aquatic Refrigeration Factory,CN,Act
5062225330,Yantai Jinlin Dairy Factory,CN,Act
5062225334,Shandong Liangshan County Xufang Daqu Co Ltd,CN,Act
5062225335,Rongcheng Shidao Mingtai Fishery CoLTD Aquatic Product Factory,CN,Act
5062225338,Xinyang Wanfu Oil & Fat Co Ltd,CN,Act
5062225342,Chaozhou Yilong Industry Group Co Ltd,CN,Act
5062225351,Zhenghong Livestock Industry Co Ltd,CN,Act
5062225367,,,
5062225369,Qinhuangdao Huixin Quick-Frozen Food Co Ltd,CN,Act
5062225382,Yushu Brewing Group CoLTD,CN,Act
5062225397,HuaiAn Huaiyin District Zhongxiaotang Pharmacy,CN,Act
5062225410,Shengsi County Huali Aquatic Products Co Ltd,CN,Act
5062225417,Fujian Xinzhongya Foodstuff Co Ltd,CN,Act
5062225427,Fujian Jinguan Foodstuff Co Ltd,CN,Act
5062225430,Fujian Anxi Honglong Tea Industry Co Ltd,CN,Act
5062225433,Xiamen Jingyuan Garden Stuff Freshness Protection CoLTD,CN,Act
5062225436,"JIANGXI YONGXIN PLASTIC PRODUCTS FACTORY CO., LTD.",CN,Act
5062225441,Qingzhou Aoda Food CoLTD,CN,Act
5062225454,Xihua County Honggou Wine Industry Co Ltd,CN,Act
5062225457,Guangshui Changsheng Rice Industry Co Ltd,CN,Act
5062225481,Guangzhou Dongyitang Foodstuff Industry Co Ltd,CN,Act
5062225496,Chongqing Tianyou Bean Products Co Ltd,CN,Act
5062225498,Sichuan Langzhong Guanglu Frozen Foodstuff Co Ltd,CN,Act
5062225504,Guizhou Juxing Industry Group Co Ltd,CN,Act
5062225506,Yunfeng Liquor CoLTDMaotaiRenhuaiGuizhou,CN,Act
5062225519,Sichuan Sanlian New Material Co Ltd,CN,Act
5062225522,Shandong Huimin County Jingu Solvent Extraction Oil Co,CN,Act
5062225529,Foshan Langchen Economy and Trade Co Ltd,CN,Act
5062225531,Wenshui Tianbofu Wine Industry Co Ltd,CN,Act
5062225540,Inner Mongolia Yushanchun Wine Supply Co Ltd,CN,Act
5062225554,Shenyang Dongtai Grain Trade Co Ltd,CN,Act
5062225557,Jilin Xuelanshan Grape Wine Supply Co Ltd,CN,Act
5062225558,Jilin Fulongda Industry Co Ltd,CN,Act
5062225561,Yushu Dongfang Grain Co Ltd,CN,Act
5062225562,Heilongjiang Junchuan Farm Yongwang Oil and Fat Factory,CN,Act
5062225563,Jixian County Rikang Plant Oil Co Ltd,CN,Act
5062225571,Nantong Jialun Foodstuff Co Ltd,CN,Act
5062225573,Nantong Lvxiang Aquatic Products Co Ltd,CN,Act
5062225577,Lianyungang Ganyu Fengyuan Rices Co Ltd,CN,Act
5062225583,Sihong County Changshun Rice Industry Co Ltd,CN,Act
5062225591,Anqing Zhushi Foodstuff Co Ltd,CN,Act
5062225605,Jiangxi Zhangshu Zhangshugong Wine Industry Co Ltd,CN,Act
5062225607,Yichun Live Pig Fixed Slaughtering Co Ltd,CN,Act
5062225609,Pingyi County Huangpo Foodstuff Factory,CN,Act
5062225614,"MENGYIN WAIMAO HUASHENG CO.,LTD",CN,Act
5062225619,Liaocheng Luxin Grain Product Co Ltd,CN,Act
5062225623,Shandong Hongda Group Co Ltd,CN,Act
5062225628,Qingdao Cunbin Peanut Products Co Ltd,CN,Act
5062225629,Qingdao Laixi Zhongliang Peanut Foodstuff Co Ltd,CN,Act
5062225633,Yanling County Jixiang Cottons CoLTD,CN,Act
5062225635,Luohe Jinyun Meat Foodstuff Co Ltd,CN,Act
5062225636,Sui County Shimeiyuan Sauce Industry Co Ltd,CN,Act
5062225640,Yunmeng County Hengxing Industry CoLTD,CN,Act
5062225644,Hunan Tianxia Dongting Lvhai Foodgrain and Cooking Oil Co Ltd,CN,Act
5062225645,Leiyang Cailun Breeding Feedstuff Co Ltd,CN,Act
5062225651,Hunan Henghui Feedstuff Co Ltd,CN,Act
5062225655,Hunan Yueyang County Futian Industry Co Ltd,CN,Act
5062225663,Foshan Shunde District Zhongtian Feed Industry Co Ltd,CN,Act
5062225668,"GUANGXI HUA HENG FEN YE FOODS CO., LTD",CN,Act
5062225672,Wangcang County Wuyuan Foodstuff Co Ltd,CN,Act
5062225674,Suining Minwang Feedstuffs Co Ltd,CN,Act
5062225676,Sichuan Longchang Tianyi Cereal & Oil Processing Factory,CN,Act
5062225677,Zizhong County Hongguang Flour Factory,CN,Act
5062225678,Leshan Changyi Foodstuffs Co Ltd,CN,Act
5062225680,Sichuan Changning County Fumin Foodstuffs Co Ltd,CN,Act
5062225681,Sichuan Yibin Linhai Zhusun Development Co Ltd,CN,Act
5062225684,Sichuan Yuechi Lianqiao Rice Flour CoLTD,CN,Act
5062225685,Tongjiang County Tianxian Foodstuffs Co Ltd,CN,Act
5062225694,Pei County Diwang Wine Factory,CN,Act
5062225698,Shaanxi Xinteruan Foodstuff Co Ltd,CN,Act
5062225699,Shenzhen Perfect Industry Corp,CN,Act
5062225702,Mishan Jinyuan Axunge & Oil Materials Co Ltd,CN,Act
5062225703,Liaozhong County Liaotian Wine Industry Co Ltd,CN,Act
5062225706,Henan Hengkang Meat Foodstuff Co Ltd,CN,Act
5062225712,Renshou County Hongsheng Feedstuff Technology Co Ltd,CN,Act
5062225713,Jianyang Jianyuan Axunge Co Ltd,CN,Act
5062225716,Wuhan Changzheng Meat Co Ltd,CN,Act
5062225717,Wuhan Fuershi Food Co Ltd,CN,Act
5062225727,Qionglai Taifeng Foodstuff Factory,CN,Act
5062225728,Chengdu Jiangfeng Stall Food CoLTD,CN,Act
5062225730,"HEBEI WANSUIYIYAO STOCK CO.,LTD",CN,Act
5062225750,Sichuan Neijiang Jinxin Livestock and Fowls Co Ltd,CN,Act
5062225757,Xiantao Chuangshiji Health Material Co Ltd,CN,Act
5062225764,Ningxia Junxingfang Food Technology Co Ltd,CN,Act
5062225766,Changchun Jialong Agriculture And Animal Husbandry Food Development Co Ltd,CN,Act
5062225784,Jiangxi Wulin Beer Co Ltd,CN,Act
5062225786,Hegang Yuanda Oil & Fat Co Ltd,CN,Act
5062225797,Zhangzhou Longwen District Xinfa Cans Foodstuff Co Ltd,CN,Act
5062225799,Dongshan County Sannan Aquatic Products Co Ltd,CN,Act
5062225808,Dazhou Weilin Meat Food CoLTD,CN,Act
5062225813,Qingdao Laixi Shunyuan Food CoLTD,CN,Act
5062225818,Xuzhou Shijixing Stall Food CoLTD,CN,Act
5062225824,Dengzhou Dikang Wine Industry Co Ltd,CN,Act
5062225827,Jiexi County Zhicheng Foodstuff Co Ltd,CN,Act
5062225834,Yunnan Lancangjiang Wine Group PuEr Co Ltd,CN,Act
5062225843,Shanxi Jinxing Beer Co Ltd,CN,Act
5062225845,Zalantun Tianding Food CoLTD,CN,Act
5062225848,Liangcheng County Longshengrong Wine Industry Co Ltd,CN,Act
5062225849,Gansu Qingyang Lvxincao Livestock Product Industry Development Co Ltd,CN,Act
5062225855,Sichuan Fuda Foodstuff Industrial Co Ltd,CN,Act
5062225873,Qingzhou Fuyuan Feedstuff Co Ltd,CN,Act
5062225876,Kaijiang County Lili Foodstuff Co Ltd,CN,Act
5062225878,Shenyang Tiancheng Feedstuff Co Ltd,CN,Act
5062225885,Guanjun Foodstuff Co Ltd,CN,Act
5062225893,Qiaoqiao Luohe Foodstuff Co Ltd,CN,Act
5062225895,Xiangcheng County Jinsheng Flour Co Ltd,CN,Act
5062225899,Jianshi County Sanyou Potatoes Development CoLTD,CN,Act
5062225900,Honghu Renjun Grease Industry and Trade CoLTD,CN,Act
5062225903,Xingyi Zhongtian Starch Processing Plant GP,CN,Act
5062225905,HuaiAn Tiancan Agriculture & Animal Husbandry Aquatic Product Co Ltd,CN,Act
5062225906,Sinkiang Taikun Group Changji Feedstuff Co Ltd,CN,Act
5062225937,Sichuan Cangxi Baxianqiao Foodstuff Co Ltd,CN,Act
5062225943,Huaibei Lunan Flour Group Co Ltd,CN,Act
5062225951,Shandong Dezheng Milks CoLTD,CN,Act
5062225959,Jiangxi Yueming Food Co Ltd,CN,Act
5062225964,Fugou County Jiuyuan Baole Dairy Industry Co Ltd,CN,Act
5062225966,Kaifeng Daqu Sanyuan Wine Factory,CN,Act
5062225971,Dongpinghu Foodstuff Co,CN,Act
5062225990,Zhucheng Jixing Foodstuff Co Ltd,CN,Act
5062225996,Linying County Jiawang Foodstuff Co Ltd,CN,Act
5062225997,Kaifeng Jiamei Deepfreeze Foodstuff Co Ltd,CN,Act
5062226006,Yuncheng Jianfeng Foodstuff Co Ltd,CN,Act
5062226008,Visionox Technology Inc,CN,Act
5062226010,Sichuan Yuechi Huamao Ceramics Factory,CN,Act
5062226012,Fengyuan Grease Chaohu Branch,CN,Act
5062226014,Qingdao Aiyuan Peanut Product Co Ltd,CN,Act
5062226017,Zhengzhou Shanghao Foodstuff Industry Co Ltd,CN,Act
5062226021,Deqing Jiulong Tea Industry Co Ltd,CN,Act
5062226024,Shantou Chaoyang District Baituo Industry Co Ltd,CN,Act
5062226033,Weifang Kangda Foodstuff Co Ltd,CN,Act
5062226035,Yuyao City Mazi Vegetable Industry CoLTD,CN,Act
5062226037,Rich-Garden Fruit & Vegetable Zhangpu Co Ltd,CN,Act
5062226043,Wenling Weiye Aquatic Products Foodstuff Co Ltd,CN,Act
5062226052,BoAi County Hongye Fine Vegetable Products Co Ltd,CN,Act
5062226057,Yancheng Yuda Feedstuff Co Ltd,CN,Act
5062226064,Sichuan Deyang Shengye Trading Shengye Edible Oil Factory Co Ltd,CN,Act
5062226065,Sichuan Chuanlong Brewery Foodstuff Co Ltd,CN,Act
5062226084,Dongshan County Hongxiang Aquatic Products Co Ltd,CN,Act
5062226086,Fujian Jinlei Foodstuff Co Ltd,CN,Act
5062226088,Fujian Wuyishan Chicheng Winery CoLTD,CN,Act
5062226091,Shantou Jinping District Zhengwei Food Factory CoLTD,CN,Act
5062226093,Huarong County Zhihedu Town Chuanlian Pickle Vegetable Factory,CN,Act
5062226095,Hengnan County Lvbei Biotechnology Co,CN,Act
5062226103,Xiantao Yuanheng Industry & Trade Co Ltd,CN,Act
5062226105,Xiuning County Shangshan Lvlan Tea Factory,CN,Act
5062226106,Anhui Jixi Shanlilao Green Foodstuff Development Co Ltd,CN,Act
5062226113,Henan Xintai Pharmaceuticals Co Ltd,CN,Act
5062226116,Lianyungang Guanyong Foodstuff Co Ltd,CN,Act
5062226127,Xinhe County Yonghong Co Ltd,CN,Act
5062226141,Tonghua Yufeng Brewing Co Ltd,CN,Act
5062226145,Xinxiang Jinlan Flour Co Ltd,CN,Act
5062226147,Kaifeng Tiantai Beverage Co Ltd,CN,Act
5062226151,Dongguan Tangxia Yuanfeng Agriculture Co,CN,Act
5062226163,ZHUJI JIFENG NATIVE PRODUCTS FOODSTUFF FACTORY,CN,Act
5062226164,Gansu Qingfa Green Foodstuff Co Ltd,CN,Act
5062226170,Laixi Chunyuan Peanut Processing Plant,CN,Act
5062226172,Shandong Liaocheng Luxi Grain Trade CoLTD,CN,Act
5062226183,Suizhou Xinxiang Industry and Trade Co Ltd,CN,Act
5062226187,Yichang Yangguang Feedstuff Co Ltd,CN,Act
5062226189,Huzhou Huajinkang Industry and Trade Co Ltd,CN,Act
5062226194,Shenyang Daguo Meat and Poultry Processing Factory,CN,Act
5062226200,Heilongjiang Emerald Grain Group Co Ltd,CN,Act
5062226207,Zhao County Zhongya Starch Co Ltd,CN,Act
5062226212,Zhongjiang County Yongtai Shunhua Grain & Oil Processing Plant,CN,Act
5062226216,Pingyi Delihui Co,CN,Act
5062226218,Zhaoyuan Kangzhu Longkou Vermicelli CoLTD,CN,Act
5062226223,Zhaosu County Grassland Cereal & Oil Industry Co Ltd,CN,Act
5062226242,Heishan County Xinxing Refined Rice Processing Co Ltd,CN,Act
5062226244,HengAn Sichuan Family Products Co Ltd,CN,Act
5062226246,Linying County Aoqiang Foodstuff Development Co Ltd,CN,Act
5062226255,Jilin Lvyuan Organic Food CoLTD,CN,Act
5062226259,Liuhe Feedstuff Huantai Branch Co Ltd,CN,Act
5062226262,Rushan Shunli Foodstuff Factory,CN,Act
5062226264,Liangshan County Xinyuan Starch Products Factory,CN,Act
5062226267,Jinjiang Fuyuan Foodstuff Hanchuan Co Ltd Co,CN,Act
5062226276,Xiangyin Xiangjiang Rice Industry Co Ltd,CN,Act
5062226283,Guangdong Yuequn BIotechnology Co Ltd,CN,Act
5062226291,Inner Mongolia Bayan NaoEr Fuyuan Agricultural Products Co Ltd,CN,Act
5062226294,Neijiang Hanfeng Agricultural Technology Development Co Ltd,CN,Act
5062226296,Qingdao Zhongkai Foodstuff Co Ltd,CN,Act
5062226306,Yanggu Jianfa Foodstuff Co Ltd,CN,Act
5062226313,Yongcheng Henghui Flour Co Ltd,CN,Act
5062226317,Sichuan Zizhong Caiyuan Brewing Foodstuff Co,CN,Act
5062226319,Guangdong Xinchaoyang Food & Beverage Co Ltd,CN,Act
5062226323,Yiliang Liziyuan Milk Foodstuff Co Ltd,CN,Act
5062226335,Lijin County Xingchang Vegetable Oil Processing Co Ltd,CN,Act
5062226338,Shandong GuAjing Wine Supply Co Ltd,CN,Act
5062226340,Linyi County Defei Flour Manufacturing Co Ltd,CN,Act
5062226341,Shandong Fengyu Group Linpan Branch Co Ltd,CN,Act
5062226344,Yueyang Hongtaiyang Cereal & Oil Co Ltd,CN,Act
5062226345,Changsha Nanniwan Foodstuff Factory,CN,Act
5062226350,Sichuan Nanchong Lvbao Fungus Industry Technology Co Ltd,CN,Act
5062226352,Sichuan Ziyang Ronghua Cereal & Oil Trade Co Ltd,CN,Act
5062226357,Zhanjiang Lianjiang Guocheng Feedstuff Co Ltd,CN,Act
5062226364,Zhenjiang Liqi Commodity Co Ltd,CN,Act
5062226372,Fujian Chunhui Teas CoLTD,CN,Act
5062226379,Shandong Zhongliang Foodstuffs Co Ltd,CN,Act
5062226380,Sichuan Changning County Yuanye Sunlei Food Development Co Ltd,CN,Act
5062226382,Wusheng County Sanxiongdi Foodstuffs Processing Factory,CN,Act
5062226384,Inner Mongolia MengE Trade and Industry CoLTD,CN,Act
5062226389,Jiangxi Shengshidan Beer Co Ltd,CN,Act
5062226393,Nanchang Tiehe Donghong Rices Co Ltd,CN,Act
5062226405,Dongkou County Meat Refrigeration Co Ltd,CN,Act
5062226416,Anqiu Deli Agriculture Non-Staple Products Co Ltd,CN,Act
5062226420,Wudi Yideyuan Meat Products Co Ltd,CN,Act
5062226426,Shucheng County Jinqiao Sports Products Factory,CN,Act
5062226429,BoAi County Xiaojing Town High-Tech Agricultural Technology Development Co Ltd,CN,Act
5062226430,Yucheng County Xingwang Foodstuff Co Ltd,CN,Act
5062226433,Nanning Wuxing Feedstuff Additive Co Ltd,CN,Act
5062226448,Shandong Jindi Food CoLTD,CN,Act
5062226454,Lianyungang Wuhuan Laver Co Ltd,CN,Act
5062226466,Hunan Tianren Paddy Industry Co Ltd,CN,Act
5062226470,Puyang County Wenlong Powder Industry Co Ltd,CN,Act
5062226473,Tongbai County Jiangji Grease CoLTD,CN,Act
5062226478,Jiangxi Tianjin Agriculture Development Co Ltd,CN,Act
5062226486,Rushan Zhengyang Foodstuffs Co Ltd,CN,Act
5062226495,Ninghua County Jiasui Rice Industry Co Ltd,CN,Act
5062226504,Gansu Suwu Villas Grape Wine Industry Co Ltd,CN,Act
5062226511,Anji County Jihua Tea Industry Co Ltd,CN,Act
5062226512,Zhejiang Fengyu Ocean Biological Products CoLTD,CN,Act
5062226518,Gong County Jinyuan Foodstuff Co Ltd,CN,Act
5062226520,Tianxia Liangcang Wine Industry,CN,Act
5062226529,Chengwu County Chunling Industry CoLTD,CN,Act
5062226530,Zaozhuang Yicheng District Jinri Food Factory,CN,Act
5062226541,Hunan Pingfeng Food Industry CoLTD,CN,Act
5062226544,Jiangsu Yesheng Technology Industrial Co Ltd,CN,Act
5062226553,Shangcai County Fuxing Meat United Processing Factory,CN,Act
5062226556,Hangzhou Jincheng Livestock Products Co Ltd,CN,Act
5062226561,Mingguang Sunong Rice Factory,CN,Act
5062226565,Shandong Wulian Lvye Food CoLTD,CN,Act
5062226566,Shandong Guosheng Foodstuff Co Ltd,CN,Act
5062226577,Meitan County Yonglong Cereal & Oil Processing Factory,CN,Act
5062226579,Wuhan Tianbing Cold Beverage Co Ltd,CN,Act
5062226593,Fujin Fuying Rice Industry Co Ltd,CN,Act
5062226594,Fujin Longfeng Economic Trade Co Ltd,CN,Act
5062226595,Nanchang Zhenxing Feedstuff Factory,CN,Act
5062226604,Nanning Wuming District Hengxingdian Powder Factory GP,CN,Act
5062226607,Ili Xinyihuan Technology Development CoLTD,CN,Act
5062226612,Ling County Xinghe Agricultural Byproduct Co Ltd,CN,Act
5062226619,Yanling County Shunxing Cotton Co Ltd,CN,Act
5062226626,Changtu County Liangzhong Fuxiangju Brewery Factory,CN,Act
5062226627,Qingyuan Man Autonomous County Shancheng Cereal & Oil Co Ltd,CN,Act
5062226633,Shantou Litao Daily Chemicals Co Ltd,CN,Act
5062226650,Yanling Zhensheng Wood Co Ltd,CN,Act
5062226656,Hebei Fucheng County Hengtong Foodstuff Co Ltd,CN,Act
5062226657,Kangbao County Huaya Cereal & Oil Co Ltd,CN,Act
5062226665,Chengdu Yingmalong Food CoLTD,CN,Act
5062226668,Danyang Hengxin Flour Co Ltd,CN,Act
5062226670,Kerisom Food Enterprises Ltd,CN,Act
5062226672,Rudong County Henglian Aquatic Products Co Ltd,CN,Act
5062226677,Fuqing Jianing Cosmetics Co Ltd,CN,Act
5062226678,Luoyuan County Hongye Foodstuff Processing Factory,CN,Act
5062226687,Nantong Runkang Biology Technology Co Ltd,CN,Act
5062226696,Fugou County Letao Flour Industry Co Ltd,CN,Act
5062226697,Pingyu County Pinghuang Jingzhi Sesame Oil Factory,CN,Act
5062226705,Jiangxi Juxian Industrial Co Ltd,CN,Act
5062226714,Donggang Jufeng Foodstuff Co Ltd,CN,Act
5062226724,Xiajin Xinlida Grease Co Ltd,CN,Act
5062226725,Rushan Zhicheng Fruit Co Ltd,CN,Act
5062226729,Qianjiang Heyi Aquatic Product Food Co Ltd,CN,Act
5062226730,Hubei Lvsheng Livestock Technology Development Co Ltd,CN,Act
5062226732,Xichang Panxing Agricultural Development Co Ltd,CN,Act
5062226733,Hubei Haiyin Biological Medicine Co Ltd,CN,Act
5062226734,Sichuan Langzhong Yuqun Farm Produce Development CoLTD,CN,Act
5062226745,Shaanxi Qinyang Changsheng Wine Industry Co Ltd,CN,Act
5062226752,Guangxi Baifei Investment Co Ltd,CN,Act
5062226769,Linying County Dajiang Trade and Industry CoLTD,CN,Act
5062226771,Jiande Chengyitang Rehabilitation Hospital Co Ltd,CN,Act
5062226791,Fujian ZhaoAn County Haili Aquatic Product Co Ltd,CN,Act
5062226792,Chengdu Jinzheng Foods Co Ltd,CN,Act
5062226798,Heze City Green Food CoLTD,CN,Act
5062226803,Lingbi County Yongsheng Powder Manufacturing Co Ltd,CN,Act
5062226812,Sichuan Liwei Foodstuff Co Ltd,CN,Act
5062226813,Dazhou Shunxin Foodstuff Co Ltd,CN,Act
5062226815,Nanbu County Yaxing Flour Factory,CN,Act
5062226831,Yanling County Hengfa Cottons CoLTD,CN,Act
5062226836,Xinyang Pingqiao District Yuxin Peanut Products Co Ltd,CN,Act
5062226837,Yongcheng Yufeng Powder CoLTD,CN,Act
5062226838,Yongcheng Qixi Flour Co Ltd,CN,Act
5062226840,Xiantao Jiuhe Yuanjinlai Grease Chemical Co Ltd,CN,Act
5062226842,Qianjiang Kangmin Sanitary Materials Factory,CN,Act
5062226866,Huaiyang County Fengyuanchun Plant Oil Co Ltd,CN,Act
5062226867,Yunnan Hongjiuzhuang Wine Co Ltd,CN,Act
5062226868,Yongzhou Xingguan Agricultural & Livestock Technology Co Ltd,CN,Act
5062226871,Xintian County Jinlong Can Foodstuff Co Ltd,CN,Act
5062226873,Changchun Qiaowei Agriculture Co Ltd,CN,Act
5062226885,Jiangsu Jinshiyuan Sugar Food Co Ltd,CN,Act
5062226893,Shandong Xinxing Starch CoLTD,CN,Act
5062226896,Shandong Binzhou Saifa Flour Co Ltd,CN,Act
5062226904,Fujian Pucheng County Lvzhixing Food CoLTD,CN,Act
5062226908,Youxi County Jinmenchun Biologic Products Co Ltd,CN,Act
5062226913,Tianjin Dinglian Foodstuff Co Ltd,CN,Act
5062226919,Xiangcheng Wanyilai Flour CoLTD,CN,Act
5062226921,Yongcheng Huaxin Flour Co Ltd,CN,Act
5062226925,PuAn County Wenliu Town Anxin Medical Packing Material Factory,CN,Act
5062226927,Henan Fuxin Islamic Meat Industry Co Ltd,CN,Act
5062226931,Yanbian Dexing Brewing Food Co Ltd,CN,Act
5062226939,Heilongjiang Nehe Beilong Rices CoLTD,CN,Act
5062226942,Heilongjiang Mudanjiang Reclamation Longtian Foodgrain & Cooking Oil ProcessingcoLTD,CN,Act
5062226946,Yingkou Economic Technology Development Zone Mingda Aquatic Products Processing Co Ltd,CN,Act
5062226952,Shandong Huanghe Sanjiaozhou Wine Industry Co Ltd,CN,Act
5062226959,Qingzhou Yishengyuan Biological Feedstuff Co Ltd,CN,Act
5062226977,Yuanshi County Baotai Starch and Grease Factory,CN,Act
5062226984,Qingdao Xingye Biology Engineering Co Ltd,CN,Act
5062226987,Qingdao Lijun Foodstuff Co Ltd,CN,Act
5062226994,Xiangyin County Hezheng Tea and Foodstuff Co Ltd,CN,Act
5062226995,Huarong County Chaqi Pickles Factory,CN,Act
5062226996,Huarong County Zhihedu Town Suansheng Pickle Factory,CN,Act
5062226998,Hunan DongAn County Lujiang Can Foodstuff Co,CN,Act
5062226999,Miluo Quyuan Alcohol Co Ltd,CN,Act
5062227005,Shenyang Reclamation Xibogong Green Food Co Ltd,CN,Act
5062227009,Jining Xuexian Flour Factory,CN,Act
5062227014,Wenzhou Hongfa Aquatic Products Foodstuff Co Ltd,CN,Act
5062227018,Gansu Jinta County Kangyuan Grease CoLTD,CN,Act
5062227020,Hefei Fengliang Industry and Trade Co Ltd,CN,Act
5062227023,GongAn County Jinyang Grease Co Ltd,CN,Act
5062227027,Yunmen County Xianhu Cereal Trade Co Ltd,CN,Act
5062227029,Suizhou Fuhua Mushroom Products Co Ltd,CN,Act
5062227030,Hubei Sanmanyuan Milks CoLTD,CN,Act
5062227033,Shaoguan Fanling Feedstuff Co Ltd,CN,Act
5062227039,Leping Tongjia Industry Co,CN,Act
5062227045,Jiangxi Zhongshi Industrial Co Ltd,CN,Act
5062227058,HaiAn County Huijiamin Feedstuff Co Ltd,CN,Act
5062227063,Xinjiang Tianshanxue Food Co Ltd,CN,Act
5062227071,Laiyang Changqing Metal Fiber CoLTD,CN,Act
5062227075,Shandong Xindaxin Dairy Industry Co Ltd,CN,Act
5062227088,Lanxi Tiansen Vegetables Foodstuff Co Ltd,CN,Act
5062227095,Maoming Haiyan Fish Powder Factory,CN,Act
5062227104,Sichuan Dahu Foodgrain & Cooking Oil Co Ltd,CN,Act
5062227105,Qiqihar Honghe Rices CoLTD,CN,Act
5062227106,Baoqing County Qixing Rice Industry Co Ltd,CN,Act
5062227107,Tangshan New Resource Ecological Sci & Tech CoLTD,CN,Act
5062227111,Xilinhaote Menglianchang Clothing Manufacturing Co Ltd,CN,Act
5062227129,Weifang Kuishan Foodstuff Co Ltd,CN,Act
5062227139,Tieling Caoshi Guxiang Wine Co Ltd,CN,Act
5062227140,Kaiyuan Hecai Grain Industry Co Ltd,CN,Act
5062227141,Tieling Dahe Islamic Meat Co Ltd,CN,Act
5062227147,Guangdong Jurentang Health Wine CoLTD,CN,Act
5062227154,Shaoxing Shangyu Shangming Tea Factory,CN,Act
5062227162,Sheyang County Tonghai Rice Industry Co Ltd,CN,Act
5062227180,Anqiu Ruifeng Foodstuff Co Ltd,CN,Act
5062227183,Laiyang Lihua Foodstuff Co Ltd,CN,Act
5062227191,Guangxi Hepu County Weiheng Sugar Industry Co Ltd,CN,Act
5062227192,Guangxi Qinzhou Qinjiang Ouya Sugar Industry Co Ltd,CN,Act
5062227213,Jiangxi Chunsi Food CoLTD Sci-Tech Park,CN,Act
5062227217,Shandong Niankang Food Beverage CoLTD,CN,Act
5062227218,Xiajin County Xinping Cotton Industry Co Ltd,CN,Act
5062227233,Sichuan Lezhi County Yingying Meat Foodstuff Co Ltd,CN,Act
5062227234,Mianyang Yonglong Islamic Food Co Ltd,CN,Act
5062227241,Luoyuan County Guangfu Foodstuff Co Ltd,CN,Act
5062227247,Yongcheng Sanxin Flour Co Ltd,CN,Act
5062227249,Tanghe County Yurong Cotton Industry Co Ltd,CN,Act
5062227254,Huanyu Gelin Grain Development Co Ltd,CN,Act
5062227259,Shandong Xinyuan Import and Export Co Ltd,CN,Act
5062227260,Shandong Dongying Qiaoxifu Foodstuff Co Ltd,CN,Act
5062227262,Xinmin Jianheng Stall Food CoLTD,CN,Act
5062227263,Yuyao Fugui Caiye Foodstuff Co Ltd,CN,Act
5062227266,Shenyang Shuanglide Foodstuff Co Ltd,CN,Act
5062227272,Anshan Juyuan Cereal Co Ltd,CN,Act
5062227273,Liaoning Xibo Foodstuff Co Ltd,CN,Act
5062227277,Liaoning Ruili Foodstuff Co Ltd,CN,Act
5062227278,ZhongAo Xifeng Islamic Foodstuff Co Ltd,CN,Act
5062227288,Changsha Economic Technology Development Zone Liao Technology Co Ltd,CN,Act
5062227290,Anxiang Laidefu Greenness Foodstuff Co Ltd,CN,Act
5062227317,Weifang Jinhe Xinshidai Food CoLTD,CN,Act
5062227333,Wuwei Jinye Wheat Germ Co Ltd,CN,Act
5062227334,Sichuan GuangAn Longnv Winery CoLTD,CN,Act
5062227336,Qianwei Jitailong Food Co Ltd,CN,Act
5062227338,Zigong Kangfulai Rice Industry Co Ltd,CN,Act
5062227339,Sichuan Zhihao Hengxiang Biotechnology Co Ltd,CN,Act
5062227344,Wengniute Qi Yulong Wine Industry Co Ltd,CN,Act
5062227350,Zhejiang Tangsong Shaoxing Wine CoLTD,CN,Act
5062227362,Qingdao Yulin Foodstuff Factory,CN,Act
5062227372,Jingning She Autonomous County Jufeng Small Loan Co Ltd,CN,Act
5062227375,Huzhou Longma Biological Technology Co Ltd,CN,Act
5062227388,Lijiang Zhongyuan Green Food Co Ltd,CN,Act
5062227389,Dehong Aohuan Group Co Ltd,CN,Act
5062227396,Zhejiang Diefei Cosmetic Co Ltd,CN,Act
5062227415,Menyuan County Sanfu Cereal & Oil Co Ltd,CN,Act
5062227417,Shandong Heze Yinuo Islamic Foodstuff Co Ltd,CN,Act
5062227421,Daishan Tongqu Aquatic Food Co Ltd,CN,Act
5062227426,"Guangzhou Co-Living International Biotechnology Co., Ltd.",CN,Act
5062227457,Yanjin County Xiaodian Kangle Plant Oil Factory,CN,Act
5062227459,Changge Guanting Country Fengyuan Bee Products Processing Factory,CN,Act
5062227461,Xinxiang County Qunxiang Non-Carbon Paper Industry Co Ltd,CN,Act
5062227462,Kaifeng Lianfu Food CoLTD,CN,Act
5062227499,Laiyang Hewang Foodstuff Co Ltd,CN,Act
5062227500,Shandong Xinze Foodstuff Co Ltd,CN,Act
5062227510,Qianguoerluosi County Lvheyuan Rices CoLTD,CN,Act
5062227513,Tonghua Baiquan Tonics Co Ltd,CN,Act
5062227522,Pingchang County Kanglong Rice Industry Co Ltd,CN,Act
5062227530,Dalian Runfeng Edible Fungus Industry Co Ltd,CN,Act
5062227531,Dalian Wanshou Foodstuffs Co Ltd,CN,Act
5062227541,Pingxiang Tianwang Foodstuffs & Beverage Factory,CN,Act
5062227559,Henan Fule Daokou Flour Industry Co Ltd,CN,Act
5062227560,Henan Sanjia Foodstuff Co Ltd,CN,Act
5062227586,Qidong County Xinglong Native Products & Animal BY-Products Co Ltd,CN,Act
5062227613,Xilin Guolemeng Dongxu Livestock Products Co Ltd,CN,Act
5062227653,Nanchong Chuixiang Food Co Ltd,CN,Act
5062227657,Zizhong County Fuyuan Meat Foodstuff Co Ltd,CN,Act
5062227660,Sheyang County Hongjian Oil & Fat Industry Co Ltd,CN,Act
5062227664,HaiAn County Fenghua Seaweeds Co Ltd,CN,Act
5062227671,Jixi County Banqiao Green Agricultural Products Development Co Ltd,CN,Act
5062227672,NingAn Shuangjiang Rice Industry Co Ltd,CN,Act
5062227684,Yantai FuErkang Biological Products Co Ltd,CN,Act
5062227698,Qi County Zhongfa Meat Sheep Foodstuff Development Co Ltd,CN,Act
5062227704,Beijing Huiyuan Group Shuangcheng Foodstuff & Beverage Co Ltd,CN,Act
5062227732,Qingdao Zhengdong Foodstuff Co Ltd,CN,Act
5062227735,DongE County Shuangfeng Powder Manufacturing Co Ltd,CN,Act
